{
  "schema_version": 1,
  "benchmark_id": "supercharger-openbind-plinder-posebench-v1",
  "methods": [
    "stdlib_descriptor_proxy",
    "simple_affinity_baselines",
    "rdkit",
    "autodock_vina",
    "boltz"
  ],
  "metrics": {
    "fixture": {
      "ranked_ligands": 4,
      "failed_controls": 1,
      "calibration_status": "fixture_only"
    }
  },
  "claim_ceiling": "candidate",
  "simple_baselines_included": true
}
